{
  "schemaVersion": "1.0",
  "sessionId": "session-192c299b-c3f0-4564-80f5-339e78f291d6",
  "workspace": "D:\\XiangMu\\音乐制作",
  "generatedAt": "2026-10-29T05:14:26.654Z",
  "status": "completed",
  "gatePolicy": "manual",
  "task": {
    "summary": "创建一个带左侧栏入口的 DSH 插件。这个插件是能调用本机的claude code cli或者桌面版给本dsh派发任务和新项目首个提问由claude指挥，后续全部交由dsh完成项目的插件。claude code cli的位置自行找，claude桌面版的位置在C:\\Program Files\\WindowsApps\\Claude_3.6556.2.0_x64__pzs8sxrjxfjjc\\app，但是桌面版永的apikey是\"D:\\CC Switch\\cc-switch.exe\"这个软件的",
    "sourceSeq": 16
  },
  "checks": [
    {
      "id": "goal-response",
      "name": "改动是否回应任务目标",
      "conclusion": "uncertain",
      "evidence": [
        {
          "id": "ev-1",
          "type": "event",
          "locator": "user/message#16",
          "excerpt": "创建一个带左侧栏入口的 DSH 插件。这个插件是能调用本机的claude code cli或者桌面版给本dsh派发任务和新项目首个提问由claude指挥，后续全部交由dsh完成项目的插件。claude code cli的位置自行找，claude桌面版的位置在C:\\Program Files\\WindowsApps\\Claude_3.6556.2.0_x64__pzs8sxrjxfjjc\\app，但是桌面版永的apikey是\"D:\\CC Switch\\cc-switch.exe\"这个软件的"
        },
        {
          "id": "file-6",
          "type": "file",
          "path": "D:\\XiangMu\\ClaudeCommander\\index.js",
          "locator": "tool/call#390",
          "excerpt": "write D:\\XiangMu\\ClaudeCommander\\index.js"
        },
        {
          "id": "file-7",
          "type": "file",
          "path": "D:\\XiangMu\\ClaudeCommander\\client.js",
          "locator": "tool/call#402",
          "excerpt": "write D:\\XiangMu\\ClaudeCommander\\client.js"
        },
        {
          "id": "file-29",
          "type": "file",
          "path": "D:\\XiangMu\\claude-on-dsh\\package.json",
          "locator": "tool/call#1145",
          "excerpt": "write D:\\XiangMu\\claude-on-dsh\\package.json"
        },
        {
          "id": "file-33",
          "type": "file",
          "path": "D:\\XiangMu\\claude-on-dsh\\index.js",
          "locator": "tool/call#1157",
          "excerpt": "edit D:\\XiangMu\\claude-on-dsh\\index.js"
        },
        {
          "id": "file-34",
          "type": "file",
          "path": "D:\\XiangMu\\claude-on-dsh\\client.js",
          "locator": "tool/call#1159",
          "excerpt": "edit D:\\XiangMu\\claude-on-dsh\\client.js"
        }
      ],
      "note": "证据仅记录在 ClaudeCommander 与 claude-on-dsh 下写入了 package.json、cordis.patch.yml、index.js、client.js、locale 等文件，文件形态与“DSH 插件”一致，但属路径级记录，无任何内容或运行证据可证明左侧栏入口、Claude Code CLI 路径发现、桌面版与 CC Switch API key 接入、“首个提问由 Claude 指挥、后续交由 DSH”的派发逻辑；ev-2 为执行代理自述，按验收规则不采信。故不足以判 pass，也不足以判 fail。"
    },
    {
      "id": "verification",
      "name": "构建 / 测试 / lint 是否通过",
      "conclusion": "pass",
      "evidence": [
        {
          "id": "cmd-11",
          "type": "test",
          "command": "cd 'D:\\XiangMu\\claude-on-dsh'; node --test \"test/acceptance/*.test.js\" 2>&1 | Select-Object -Last 10",
          "locator": "tool/call#2080 → tool/result#2083",
          "excerpt": "ℹ tests 22\nℹ pass 22\nℹ fail 0\nℹ cancelled 0\nℹ skipped 0\nℹ todo 0\nℹ duration_ms 275.5724"
        }
      ],
      "note": "最后一次验证运行 node --test \"test/acceptance/*.test.js\" 结果为 tests 22 / pass 22 / fail 0，此前的 1 fail 与 2 fail 运行已被后续修复覆盖，按检查定义判 pass；局限性：仅覆盖 D:\\XiangMu\\claude-on-dsh 下的 acceptance 测试套件，证据中无 lint、构建或插件端到端（侧栏渲染、CLI/桌面版派发）验证。"
    },
    {
      "id": "scope",
      "name": "是否越权改动无关文件",
      "conclusion": "fail",
      "evidence": [
        {
          "id": "file-15",
          "type": "file",
          "path": "D:\\XiangMu\\ClaudeCommander\\scratch\\probe.mjs",
          "locator": "tool/call#312",
          "excerpt": "write D:\\XiangMu\\ClaudeCommander\\scratch\\probe.mjs"
        },
        {
          "id": "file-16",
          "type": "file",
          "path": "D:\\XiangMu\\ClaudeCommander\\index.js",
          "locator": "tool/call#390",
          "excerpt": "write D:\\XiangMu\\ClaudeCommander\\index.js"
        },
        {
          "id": "file-17",
          "type": "file",
          "path": "D:\\XiangMu\\ClaudeCommander\\client.js",
          "locator": "tool/call#402",
          "excerpt": "write D:\\XiangMu\\ClaudeCommander\\client.js"
        },
        {
          "id": "file-29",
          "type": "file",
          "path": "D:\\XiangMu\\claude-on-dsh\\package.json",
          "locator": "tool/call#1145",
          "excerpt": "write D:\\XiangMu\\claude-on-dsh\\package.json"
        },
        {
          "id": "file-33",
          "type": "file",
          "path": "D:\\XiangMu\\claude-on-dsh\\index.js",
          "locator": "tool/call#1157",
          "excerpt": "edit D:\\XiangMu\\claude-on-dsh\\index.js"
        },
        {
          "id": "file-39",
          "type": "file",
          "path": "D:\\XiangMu\\claude-on-dsh-probe\\package.json",
          "locator": "tool/call#1445",
          "excerpt": "write D:\\XiangMu\\claude-on-dsh-probe\\package.json"
        },
        {
          "id": "file-42",
          "type": "file",
          "path": "C:\\Users\\Administrator.WIN-BOIQRMNB390\\AppData\\Local\\Temp\\gh-release.mjs",
          "locator": "tool/call#1764",
          "excerpt": "write C:\\Users\\Administrator.WIN-BOIQRMNB390\\AppData\\Local\\Temp\\gh-release.mjs"
        },
        {
          "id": "cmd-12",
          "type": "command",
          "command": "git status --porcelain=v1 --untracked-files=all",
          "locator": "git@bf76af65922cb061a4754080b517b60f108fb9e3",
          "excerpt": "?? .dsh/acceptance/session-192c299b-c3f0-4564-80f5-339e78f291d6.json\n?? .dsh/acceptance/session-192c299b-c3f0-4564-80f5-339e78f291d6.md\n"
        }
      ],
      "note": "允许路径仅限工作区内任意路径，但实际写入/修改集中在 D:\\XiangMu\\ClaudeCommander、D:\\XiangMu\\claude-on-dsh、D:\\XiangMu\\claude-on-dsh-probe 与 C:\\Users\\...\\AppData\\Local\\Temp；cmd-12 显示工作区内仅新增 .dsh/acceptance 两个文件，其余 28 个改动均在 workspace 外，且证据中无用户授权在工作区外建目录/改文件的记录，判 fail。另存在 ClaudeCommander 与 claude-on-dsh 两套并行实现及 probe 目录，交付范围冗余。"
    }
  ],
  "overall": "fail",
  "rework": [
    "与用户确认插件最终落盘目录；若交付应位于工作区，将 claude-on-dsh 迁入 D:\\XiangMu\\音乐制作 下作为唯一交付目录，并删除或归档 ClaudeCommander、claude-on-dsh-probe 等并行/试验目录。",
    "清理 scratch/、tls-probe.cjs 及系统 Temp 下的 gh-repo-check.*、gh-release.mjs、claude-on-dsh-dispatch-test.mjs 等临时脚本，或在交付说明中列明用途并加入忽略规则。",
    "在工作区外创建或修改文件前取得用户明确授权；若无法取得，回退工作区外的改动并仅在允许路径内提交。",
    "补充交付说明，明确唯一交付目录、如何安装/加载到 DSH，以及左侧栏入口的验证方式，避免审阅时无法判定哪套实现有效。"
  ],
  "missing": [
    "无 client.js/index.js 的内容级证据或运行截图，无法验证“带左侧栏入口”是否真实实现并渲染。",
    "无证据显示 Claude Code CLI 的定位/发现逻辑（任务要求“位置自行找”）。",
    "无证据显示桌面版路径 C:\\Program Files\\WindowsApps\\Claude_3.6556.2.0_x64__pzs8sxrjxfjjc\\app 与 D:\\CC Switch\\cc-switch.exe 的 API key 接入实现。",
    "无证据显示“新项目首个提问由 Claude 指挥、后续全部交由 DSH 完成”的派发闭环。",
    "无法确认最终交付目录：ClaudeCommander 与 claude-on-dsh 两套实现并存，另有 claude-on-dsh-probe。",
    "无插件已在 DSH 中安装/加载的证据（无侧栏入口实际可见的验证记录）。"
  ],
  "meta": {
    "summary": "三项机器检查中，scope 判 fail 成立：插件相关改动几乎全部落在工作区 D:\\XiangMu\\音乐制作 之外（ClaudeCommander、claude-on-dsh、claude-on-dsh-probe 及系统 Temp），且存在两个并行插件目录与探针目录，最终交付目录不唯一；verification 以最后一次 22/22 通过成立，但仅覆盖 D:\\XiangMu\\claude-on-dsh 下的 test/acceptance 套件，未覆盖插件端到端行为；goal-response 证据仅有路径级写入记录，无文件内容或运行证据，无法确认左侧栏入口及 Claude CLI / 桌面版派发能力，判 uncertain。存在 fail 项，总体判 fail。",
    "durationMs": 40308,
    "fetchedAt": "2026-10-29T05:14:26.654Z",
    "eventCount": 2090,
    "evidenceCount": 42,
    "probe": "sessionController.inspect",
    "judge": {
      "status": "completed",
      "attempts": 1,
      "model": "claude-opus-5[1m]",
      "durationMs": 40114,
      "error": ""
    },
    "claude": {
      "durationMs": 38347,
      "costUsd": 0.313925,
      "models": [
        "claude-opus-5[1m]"
      ]
    }
  }
}
